{
    "participant_id": {
        "LongName": "Participant Identifier",
        "Description": "Unique BIDS identifier for the participant in this study."
    },
    "snellen_aid_y": {
        "Description": "Do you wear any necessary corrective aids (glasses, contacts)? | 1 = Yes; 0 = No; Starting from the top of the chart, please read aloud one row at a time from left to right until I tell you to stop. If needed,  say  Keep going.",
        "Levels": {
            "1": "Yes",
            "0": "No"
        }
    },
    "snellen_aidpres_y": {
        "Description": "Are you wearing them now?                            Ensure subject is wearing them) | 1 = Yes; 0 = No; Starting from the top of the chart, please read aloud one row at a time from left to right until I tell you to stop. If needed,  say  Keep going.",
        "Levels": {
            "1": "Yes",
            "0": "No"
        }
    },
    "snellen_va_y": {
        "Description": "1. Ensure that the chart is located in a well lit area and readily readable. 2. Verify if the child has corrective lenses and if so, whether he or she is wearing them. 3. Ascertain whether h/she can appropriately respond to stimuli on an iPad screen.\nSmallest line subject was able to see without error? Line numbers are represented on the right-most side of the chart. | 0 = Can't read line 1; 1 = Line 1; 2 = Line 2; 3 = Line 3; 4 = Line 4; 5 = Line 5; 6 = Line 6; 7 = Line 7; 8 = Line 8; 9 = Line 9; 10 = Line 10; 11 = Line 11 // Users should consider variations in visual status (Snellen) before analyzing the neurocognition data. Many children have scores indicating poor vision.",
        "Levels": {
            "0": "Can't read line 1",
            "1": "Line 1",
            "2": "Line 2",
            "3": "Line 3",
            "4": "Line 4",
            "5": "Line 5",
            "6": "Line 6",
            "7": "Line 7",
            "8": "Line 8",
            "9": "Line 9",
            "10": "Line 10",
            "11": "Line 11 // Users should consider variations in visual status (Snellen) before analyzing the neurocognition data. Many children have scores indicating poor vision."
        }
    },
    "vis_flg": {
        "Description": "Can the participant read the stimuli on the iPad? | 1 = YES = proceed with testing; 2 = NO = stop testing"
    }
}